100k0c9,"I started university in September, and i‚Äö√Ñ√¥ve had a nice time there. About a month ago i started relapsing in my ed and now have no energy and honestly i just want to get really ill. I am currently at home so they can‚Äö√Ñ√¥t do any medical monitoring or anything. I have two summative pieces of work due in on the 15th which i have not started nor do i see myself doing. 
 I just don‚Äö√Ñ√¥t know what to do. I can‚Äö√Ñ√¥t carry on uni if i don‚Äö√Ñ√¥t change what i‚Äö√Ñ√¥m doing, which i kind of want? I don‚Äö√Ñ√¥t want to have to make decisions or have to deal with life. I want to relapse and get really ill. I‚Äö√Ñ√¥m just hopeless",,,,,,,,,,,,,,,,,,,,,,,,,,,,,,,,,,,,,,,,,,,,,,,,,,0,,1,started university in September,"started university, summative work due, overwhelmed with responsibilities",starting university,1,starting university,,,1,,starting university,,0,,,,3
10083xu,"Last night I got into a pretty horrible fight with my partner because he was drunk (more accurately he was fighting ‚Äö√Ñ√∫at‚Äö√Ñ√π me, which used to be a very common occurrence unfortunately). He‚Äö√Ñ√¥s struggled with alcoholism for many years, but last night was the first time in a long time that he relapsed. I won‚Äö√Ñ√¥t go into the details (he wasn‚Äö√Ñ√¥t psychically or sexually abusive), but it was extremely scary and difficult for me emotionally. He has quit drinking once again (as of today), but my anxiety is through the fucking roof. 
 
 I have been trying to attempt quasi-recovery for the last few weeks, and although I intended to eat dinner last night, I did not because I was so scared and distraught by my partner‚Äö√Ñ√¥s behavior. I actually had to call out of work today, which I NEVER do, because my anxiety has been so bad. He‚Äö√Ñ√¥s been sick all day throwing up from the alcohol, and once his stomach settled he told me that he was going to maybe order a pizza (we have basically no food in the house and I have exhausted all of my safe foods, which he wouldn‚Äö√Ñ√¥t eat anyway). I told myself that I should try to eat a slice of pizza, but he ended up ordering something he knew I really didn‚Äö√Ñ√¥t like and now he‚Äö√Ñ√¥s just eating like a fucking king while I‚Äö√Ñ√¥m angry, anxious and starving and I‚Äö√Ñ√¥m pissed at him for yet another reason. It‚Äö√Ñ√¥s so fucking dumb but like‚Äö√Ñ¬∂ you‚Äö√Ñ√¥re not even going to ask me if I want anything? After fucking terrorizing me for 8 hours last night? I feel so stupid typing this out, but my ED is telling me that I don‚Äö√Ñ√¥t deserve to eat and I don‚Äö√Ñ√¥t know what to do.","boyfriend was scaring girlfriend and caused the writer to feel very anxious and incredibly upset, boyfriend didn't order any food for girlfriend when she really needed it",0.0833333333333333,0.1111111111111111,0.0952380903401363,0.125,0.25,0.1666666622222223,0.0416666666666666,0.1428571428571428,0.0645161255359003,0.1666666666666666,0.3076923076923077,0.2162162116581447,0.0833333333333333,0.1818181818181818,0.1142857099755103,0.125,0.2307692307692307,0.1621621576040907,0.0416666666666666,0.0833333333333333,0.0555555511111114,0.0833333333333333,0.1538461538461538,0.1081081035500367,0.0833333333333333,0.1111111111111111,0.0952380903401363,0.0416666666666666,0.1,0.0588235252595158,,,,,,,0.125,0.25,0.1666666622222223,0.1666666666666666,0.3076923076923077,0.2162162116581447,0.0833333333333333,0.1538461538461538,0.1081081035500367,0.0416666666666666,0.1,0.0588235252595158,1,"external, external",1,"['getting into a fight with her partner who was drunk and had a history of alcoholism', 'feeling scared and distraught']","['fight with partner', 'partner ordering food they know the writer does not like']",['partner getting drunk and fighting with them'],1,"partner's relapse and fight, partner ordering pizza but not offering any to writer","fight with drunk partner, partner eating good food but not offering any","['fight with partner when he relapsed into alcoholism', ""partner ordering food writer doesn't like""]",1,"['partner relapsing', 'fight with partner', 'lack of food options', ""partner not considering writer's needs""]","['partner getting drunk and fighting at them', 'partner not offering food', 'exhausting safe foods']","['fight with partner because of partner being drunk', 'partner ordering food that is not safe food', 'partner not asking if writer wants anything']",1,"['partner relapsing with alcohol', 'fight with partner', ""partner not considering writer's food needs""]",,,4
zz4itq,"I‚Äö√Ñ√¥ve been crying the whole morning because I‚Äö√Ñ√¥ve realised that a lot of people think I‚Äö√Ñ√¥m older than I am. My fianc‚àö¬© had his friends over last night and when he told them the year I was born in they couldn‚Äö√Ñ√¥t believe it. I texted my fianc‚àö¬© what to ask what they meant by that but he didn‚Äö√Ñ√¥t respond and they left the house. I asked him this morning and he said he doesn‚Äö√Ñ√¥t remember why they were shocked. I can only assume that it‚Äö√Ñ√¥s because I look older. 
 
 My younger brother (3.5 years younger) avoids hanging out with me because I‚Äö√Ñ√¥m too old or not cool enough). 
 
 My coworkers keep forgetting my age and think I‚Äö√Ñ√¥m older than I am. I work in a virtual office but we do most of our meetings over video chat. 
 
 At Costco a few months ago one of the sample ladies offered me a ‚Äö√Ñ√∫fridge magnet for the kids.‚Äö√Ñ√π I joked about it with my fianc‚àö¬© later and he said ‚Äö√Ñ√∫but I actually like that you look like a milf‚Äö√Ñ√π
 
 I know people typically associate weight with age so I can‚Äö√Ñ√¥t stop thinking that people feel this way about me because I am fat. I‚Äö√Ñ√¥ve been trying my hardest to keep my ed on the back burner for the holiday season. SNS has been inundating me with the stupid posts about how a woman is prettiest at 22 and people care more for pretty girls and now my birthday is coming and people think I‚Äö√Ñ√¥m older. I feel like I wasted my most attractive year. That now I‚Äö√Ñ√¥m stuck looking like I‚Äö√Ñ√¥ve had 3 kids for the rest of my life. I don‚Äö√Ñ√¥t want to live on this body but dying isn‚Äö√Ñ√¥t an option so I guess I‚Äö√Ñ√¥ll starve myself towards youth. I‚Äö√Ñ√¥m not going to try to feed myself anymore. When my meds wear off and my appetite comes back I‚Äö√Ñ√¥ll just use the appetite suppressant. I don‚Äö√Ñ√¥t want to be trapped in being old.","people are overestimating their age/thinking that they're older then they actually are, feeling judged and insecure about body image",0.1578947368421052,0.1428571428571428,0.1499999950125001,0.1578947368421052,0.25,0.193548382351717,0.2631578947368421,0.2777777777777778,0.2702702652739226,0.2631578947368421,0.3333333333333333,0.2941176421280277,0.1578947368421052,0.2,0.1764705833044984,0.1578947368421052,0.25,0.193548382351717,0.1052631578947368,0.0666666666666666,0.0816326483132031,0.1052631578947368,0.0625,0.0784313678738949,0.2631578947368421,0.1515151515151515,0.1923076876701184,0.1052631578947368,0.0952380952380952,0.0999999950125002,0.2105263157894736,0.2,0.2051282001314925,0.2631578947368421,0.25,0.2564102514135438,0.2631578947368421,0.2777777777777778,0.2702702652739226,0.2631578947368421,0.3333333333333333,0.2941176421280277,0.2631578947368421,0.1515151515151515,0.1923076876701184,0.2631578947368421,0.25,0.2564102514135438,1,"external, internal",1,"['being perceived as older than she is', 'social media posts about age and beauty standards', 'brother rejecting her for being too old']","['people think I am older than I am', 'feeling unattractive because of my weight']","['feeling like people think she looks older due to weight', 'obsessing over SNS posts about age and beauty']",1,"['feeling judged for looking older than her age', 'social media posts about age and beauty standards']","['people thinking she looks older than she is', 'SNS inundating with posts on age and beauty']","['feeling like people think she is older because she isfat', 'turning a year older']",1,"['fiancé’s friends thinking she looks older', 'younger brother avoids hanging out with her', 'coworkers thinking she looks older', 'sample lady offering a fridge magnet for kids', 'SNS posts about women being prettiest at 22']","['fiancé’s friends thinking writer is older', 'brother avoiding writer because she is “too old” or “not cool enough”', 'coworkers forgetting writer’s age', 'being called a milf', 'seeing posts about women being most attractive at 22']","['feeling like people think she is older due to weight and appearance', 'seeing posts about women being the prettiest at 22', 'being called a ""milf""', 'trying to keep ED on the back burner for holiday season']",1,"['feeling like she looks older', 'brother avoiding her because she is not cool enough', 'coworkers forgetting her age', 'sample lady implying she looks like a mom']","['feeling older than actual age', 'brother avoiding her', 'coworkers forgetting her age', 'joking about looking like a milf', 'SNS posts about age and beauty']","['feeling like people think she looks older', 'comments from fianc√©', 'comments from sample lady at Costco', 'SNS posts about age and attractiveness']",4
zxpj49,"so pretty much the only parts of my body that i‚Äö√Ñ√¥ve ever been ‚Äö√Ñ√≤proud‚Äö√Ñ√¥ of are my chestbones and hipbones because they‚Äö√Ñ√¥re kind of prominent and poke out a bit.
 but the longer i look at myself, the more sure i become that they only show because my pelvic bone and ribcage are ridiculously huge. like, so massive they would show if i was 300+ lbs. i feel so fake because i‚Äö√Ñ√¥m just‚Äö√Ñ¬∂flabby. all of my bones should show at the weight i‚Äö√Ñ√¥m at. can someone be small framed but at the same time, have certain bones be huge?? i feel like i‚Äö√Ñ√¥m losing my mind for not noticing earlier. i‚Äö√Ñ√¥m not skinny at all, my bones just jut out because they‚Äö√Ñ√¥re too big for my body. i feel like an alien trying to wear a human skin as a disguise ever since this discovery.",Feeling very insecure about chestbones and hipbones,,,,,,,0.0,0.0,0.0,,,,,,,0.0,0.0,0.0,0.0,0.0,0.0,0.0,0.0,0.0,,,,0.0,0.0,0.0,0.0,0.0,0.0,0.2857142857142857,0.2857142857142857,0.2857142807142858,0.0,0.0,0.0,0.0,0.0,0.0,0.0,0.0,0.0,0.2857142857142857,0.2857142857142857,0.2857142807142858,1,internal,1,,,"['self-image', 'body perception']",1,,,realizing certain bones are huge,1,discovering that certain bones are huge,realization that certain bones are huge,,1,"['obsessive scrutiny of body', 'perception that bones are too big', 'feeling like an imposter in own body']",['obsessing over bones'],['obsessive thoughts about body and bones size'],4
zxhn2d,"so I‚Äö√Ñ√¥m about bmi &gt;!16!&lt; and am trying to maintain, I eat about &gt;!1500-1600!&lt; cals per day, but I also compulsively walk about &gt;!20,000!&lt; steps per day. I wanna stop doing this, but I‚Äö√Ñ√¥m not really ready to gain weight yet, so this would result in my appetite going down and eating significantly less. I‚Äö√Ñ√¥m wondering if it‚Äö√Ñ√¥s better to keep walking and eating more, or stop walking and eat less??? Idk I know ultimately it‚Äö√Ñ√¥s better to stop walking and not change the amount I eat at all, but I‚Äö√Ñ√¥m short and would have to gain about 50 pounds to be able to eat that much and maintain without moving at all Ô£ø√º√≤‚â† also I‚Äö√Ñ√¥m sorry if this isn‚Äö√Ñ√¥t allowed, or counts as being ‚Äö√Ñ√∫pro‚Äö√Ñ√π I‚Äö√Ñ√¥m just trying to decide what I should do","Walking 20,000 steps compulsively",,,,,,,0.25,0.1666666666666666,0.1999999952000001,,,,,,,,,,0.0,0.0,0.0,,,,0.0,0.0,0.0,,,,,,,,,,0.25,0.1666666666666666,0.1999999952000001,,,,0.0,0.0,0.0,,,,1,external,1,,,"['walking compulsively', 'fear of weight gain']",0,,,,1,"['compulsive walking', 'fear of gaining weight']",,compulsive walking and fear of gaining weight,0,,,,2
zxcczr,"I'm 16FTM. I'll try to write a small paragraph before any numbers so mobile users don't get spooked. 
 
 I started recovery a month ago. It's been great! I've eaten a lot, maybe even a little bit too much, but after two months of severe undereating (according to my doctor), I don't think a few days of eating too much matter. My body says otherwise though.
 
 Since starting recovery, I've gained &gt;!6 kg!&lt; of weight. I think it's the fact that my body hasn't adapted yet, but I'm not sure. Before recovery, I was eating &gt;!&lt;1000 cals!&lt; a day and still gained (yes, it's real, it happened, it wasn't a thyroid problem or anything), is this caused by that? I gained about a kilo each week back then. Is my body still insisting that my maintenance is... nothing? That I should eat nothing or I'll gain? 
 
 Is there any way to fix this? I've gained so much weight and I've become aware of all my fat rolls touching and all that again, which is one of the main reasons my ED started. I don't want to gain more, I've already gained &gt;!7 kg!&lt;, the reason why I said &gt;!6!&lt; was because I think the last one is water weight but then again, the rest were supposed to be water weight as well but they still haven't gone away! I'm almost back at the weight I was at last year and I wasn't happy then, why should I be happy now? I want to disappear","comparing their body weight to what they were last year, weight gain",0.2727272727272727,0.5,0.3529411719031142,0.1818181818181818,0.4,0.2499999957031251,0.0,0.0,0.0,0.0909090909090909,0.25,0.1333333294222223,0.0909090909090909,0.25,0.1333333294222223,0.0909090909090909,0.2,0.1249999957031251,0.0909090909090909,0.125,0.1052631530193908,0.2727272727272727,0.2727272727272727,0.2727272677272728,0.1818181818181818,0.2222222222222222,0.1999999950500001,0.2727272727272727,0.6,0.374999995703125,0.1818181818181818,0.2857142857142857,0.2222222174691359,0.2727272727272727,0.5,0.3529411719031142,0.2727272727272727,0.5,0.3529411719031142,0.0909090909090909,0.25,0.1333333294222223,0.2727272727272727,0.2727272727272727,0.2727272677272728,0.2727272727272727,0.6,0.374999995703125,1,"internal, internal",1,"['eating too much', 'body weight gain']","['weight gain', 'fat rolls touching']","['gained over 6 kg', 'become aware of all my fat rolls touching again']",1,gained weight in recovery,gaining weight in recovery,gained weight from starting recovery,1,"['gaining weight too fast and too much', 'ED thoughts']","['weight gain', 'not feeling comfortable in body', 'fears of gaining more']","['feeling body fat and rolls', 'gaining weight in recovery']",1,"['weight gain', 'body image issues']","['gaining weight', 'awareness of body', 'fat rolls']","['weight gain', 'food intake', 'body image']",4
zx6hmt,"I can‚Äö√Ñ√¥t see myself ever getting out of this. I‚Äö√Ñ√¥ve had an eating disorder since I was 14, I am 18 now. It is a huge part of my daily life. I don‚Äö√Ñ√¥t think I went a day not counting calories for 4 years. I can‚Äö√Ñ√¥t ever see myself not chasing some thin ‚Äö√Ñ√∫aesthetic‚Äö√Ñ√π and lifestyle, even if I‚Äö√Ñ√¥m failing at it for periods of times. There is something truly addictive about this disorder, it‚Äö√Ñ√¥s like a drug. Why do I want to be sick? Why do I want to be smaller? Why do I enjoy having this curse on me sometimes? Perhaps because I am a self harmer but I‚Äö√Ñ√¥m not sure why that is either. Ugh. I fucking hate eating disorders.",,,,,,,,,,,,,,,,,,,,,,,,,,,,,,,,,,,,,,,,,,,,,,,,,,0,,0,,,,0,,,,0,,,,0,,,,0
zwzvzc,I would like to start this off by saying that the guy I‚Äö√Ñ√¥m talking to now is probably one of the sweetest most adorable guys I have talked to but when I was call tonight we were talking about how one of my legs in a photo I sent him made it look like I was bow legged (which I kinda am). Soon after he started calling me chicken legged this brought me back to when my ex would call me man legs for having big thighs that were made up of mostly muscle which I have now lost dew to Ana. My thighs have always been a big insecurity of mine and I still don‚Äö√Ñ√¥t think they‚Äö√Ñ√¥re small. I don‚Äö√Ñ√¥t why but it‚Äö√Ñ√¥s kinda making me feel uncomfortable when he said it I might just be dramatic because I have relapsed and am in heavy restrict mode rn,Being called chicken legged by her boyfriend,0.4285714285714285,0.2,0.2727272683884298,0.0,0.0,0.0,0.4285714285714285,0.375,0.3999999950222222,0.5714285714285714,0.4444444444444444,0.4999999950781251,0.4285714285714285,0.3,0.3529411716262976,0.5714285714285714,0.8,0.6666666618055556,0.4285714285714285,0.2727272727272727,0.3333333285802469,0.7142857142857143,0.625,0.6666666616888889,0.5714285714285714,0.3076923076923077,0.3999999954500001,0.0,0.0,0.0,0.7142857142857143,0.2941176470588235,0.4166666625347223,0.5714285714285714,0.3333333333333333,0.4210526269252078,0.4285714285714285,0.375,0.3999999950222222,0.5714285714285714,0.8,0.6666666618055556,0.7142857142857143,0.625,0.6666666616888889,0.7142857142857143,0.3333333333333333,0.4210526269252078,1,external,1,"['the guy started calling me chicken legged', 'reminded me of when my ex called me man legs']","['comments on physical appearance', 'comparisons to ex']","['talked about leg appearance', 'was called chicken legged']",1,guy she is talking to called her chicken legged,guy called me chicken legged re: my leg in photo,guy called her chicken legged,1,"['current relationship partner calling her ""chicken legged""', 'remembering ex calling her ""man legs""']","['boyfriend called her ""chicken legged""', 'ex-boyfriend called her ""man legs""']","['guy she is talking to calls her chicken legged', 'ex called her man legs']",1,"['comment from guy about legs', 'previous comment from ex about legs', 'insecurity about thighs']","['guy calling her ""chicken legged""', 'previous experience of being called ""man legs"" by ex', 'thigh insecurity', 'relapse']","['being called ""chicken legged""', 'ex calling her ""man legs""', 'insecurities about thighs']",4
zwqjyt,"A couple of hours ago I noticed a peculiar lump near my a hole‚Äö√Ñ¬∂ I‚Äö√Ñ√¥ve searched online frantically and from what I‚Äö√Ñ√¥ve gathered it‚Äö√Ñ√¥s prob hemorrhoids. I am now incredibly scared and just so fucking embarrassed. 
 
 I‚Äö√Ñ√¥ve heard that you can get it from laxative abuse or constipation. I didn‚Äö√Ñ√¥t abuse laxatives but I did use it two times this month because both times I was constipated for a week. I‚Äö√Ñ√¥ve also just took a shit on my own but I strained and apparently straining is bad and can cause hemorrhoids (why tf have i never known about this). The lump is not painful, but it is somewhat sensitive. There is no blood and no other symptoms apart from the bump itself.
 
 Idk should I go to the doctor? I‚Äö√Ñ√¥m so embarrassed and anxious I‚Äö√Ñ√¥m on the verge of crying. I just really really want it go away by itself T_T","laxative abuse which is causing hemorrhoids, feeling embarassed and anxious because of hemerrhoids",0.0,0.0,0.0,0.0,0.0,0.0,0.0,0.0,0.0,,,,,,,,,,0.0,0.0,0.0,0.0769230769230769,0.25,0.1176470552249136,0.0,0.0,0.0,,,,,,,,,,0.0,0.0,0.0,,,,0.0769230769230769,0.25,0.1176470552249136,,,,1,"external, internal",1,"['constipation', 'straining']","['constipation', 'straining']","['constipation', 'straining during bowel movement']",0,,,,1,"['constipation', 'straining']","['constipation', 'fear of embarrassment']","['constipation', 'straining']",0,,,,2
zvwy0q,"I‚Äö√Ñ√¥ve never posted in this group before, mostly because I‚Äö√Ñ√¥ve been in denial for the last 2 years that I even have an ED.. but I almost lost my life to this disorder July 1st and am still struggling day to day to stay alive.. (I am 21) 
 
 Before this started to go way downhill for me- I had my own rental home, I was working 2 jobs (professional cleaner and high end retail) as well as running my own clothing business.. I was also modelling and singing in a band. That all fell apart and when I ended up in hospital I lost all of that apart from my retail job. 
 But now I am slowly being made redundant from that too..
 
 In New Zealand it is extremely difficult to get by without money behind you.. I am receiving support from the government but it‚Äö√Ñ√¥s just not enough and I‚Äö√Ñ√¥m struggling to make ends meet without a steady income.. 
 
 I am close to coming to my end days with this disorder.. my memory is lapsing everyday, im apathetic, can‚Äö√Ñ√¥t regulate my blood sugar levels correctly, my hair is falling out.. the whole shebang and I am almost back at the weight that had my heart failing in July. 
 
 So I guess what I‚Äö√Ñ√¥m trying to ask is ‚Äö√Ñ√∫what do you all do for work?‚Äö√Ñ√π 
 Trying to find a job in NZ can be challenging on its own, but I don‚Äö√Ñ√¥t want to throw myself into another job if my body can‚Äö√Ñ√¥t handle the work.. 
 
 I‚Äö√Ñ√¥d love to know what some of you do for work while working towards recovery ‚Äö√π¬ß√î‚àè√®",has trouble getting steady income in new zealand but lack of job is causing them to struggle,,,,,,,0.0588235294117647,0.0714285714285714,0.0645161240790846,,,,,,,,,,,,,,,,,,,,,,,,,,,,0.0588235294117647,0.0714285714285714,0.0645161240790846,,,,,,,,,,1,external,1,,,"['almost lost my life to this disorder July 1st', 'now struggling to make ends meet']",0,,,,0,,,,0,,,,1
