id,selftext,grouped_trigger_label,recall_zero_shot_0,precision_zero_shot_0,f1_zero_shot_0,recall_zero_shot_1,precision_zero_shot_1,f1_zero_shot_1,recall_zero_shot_2,precision_zero_shot_2,f1_zero_shot_2,recall_few_shot_3_0,precision_few_shot_3_0,f1_few_shot_3_0,recall_few_shot_3_1,precision_few_shot_3_1,f1_few_shot_3_1,recall_few_shot_3_2,precision_few_shot_3_2,f1_few_shot_3_2,recall_few_shot_3_include_multiple_0,precision_few_shot_3_include_multiple_0,f1_few_shot_3_include_multiple_0,recall_few_shot_3_include_multiple_1,precision_few_shot_3_include_multiple_1,f1_few_shot_3_include_multiple_1,recall_few_shot_3_include_multiple_2,precision_few_shot_3_include_multiple_2,f1_few_shot_3_include_multiple_2,recall_few_shot_1_include_multiple_0,precision_few_shot_1_include_multiple_0,f1_few_shot_1_include_multiple_0,recall_few_shot_1_include_multiple_1,precision_few_shot_1_include_multiple_1,f1_few_shot_1_include_multiple_1,recall_few_shot_1_include_multiple_2,precision_few_shot_1_include_multiple_2,f1_few_shot_1_include_multiple_2,recall_zero_shot,precision_zero_shot,f1_zero_shot,recall_few_shot_3,precision_few_shot_3,f1_few_shot_3,recall_few_shot_3_include_multiple,precision_few_shot_3_include_multiple,f1_few_shot_3_include_multiple,recall_few_shot_1_include_multiple,precision_few_shot_1_include_multiple,f1_few_shot_1_include_multiple,has_trigger_label,grouped_trigger_type_label,has_trigger_predicted_zero_shot,trigger_0_zero_shot,trigger_1_zero_shot,trigger_2_zero_shot,has_trigger_predicted_few_shot_3,trigger_0_few_shot_3,trigger_1_few_shot_3,trigger_2_few_shot_3,has_trigger_predicted_few_shot_3_include_multiple,trigger_0_few_shot_3_include_multiple,trigger_1_few_shot_3_include_multiple,trigger_2_few_shot_3_include_multiple,has_trigger_predicted_few_shot_1_include_multiple,trigger_0_few_shot_1_include_multiple,trigger_1_few_shot_1_include_multiple,trigger_2_few_shot_1_include_multiple,trigger_score
10eemqs,"It‚Äö√Ñ√¥s breaking me apart to read through these posts. I‚Äö√Ñ√¥ve mostly recovered and I‚Äö√Ñ√¥m WR, but reading what I used to put myself through was so eye opening and it‚Äö√Ñ√¥s scary to see how many reblogs/likes they would get. I contribute to a horrible community full of self destruction and I can‚Äö√Ñ√¥t help but feel a little triggered into this weird, like, feeling I need to prove myself again? For example I made a post that was something like &gt;! Blah blah HORRIFICALLY UNHEALTHY THING TO DO, if I eat __ calories per day I‚Äö√Ñ√¥ll reach my GW in 24 days !&lt; and I immediately thought, omg, I can? Maybe I could do better? And I don‚Äö√Ñ√¥t know what‚Äö√Ñ√¥s wrong with me! I haven‚Äö√Ñ√¥t relapsed in a long time and I don‚Äö√Ñ√¥t want to, but the feeling of guilt and seeing these posts is making me all confused and competitive and self depreciated. Ugh.",Reading posts from reddit,0.25,0.125,0.1666666622222223,0.25,0.1,0.1428571387755103,0.25,0.1,0.1428571387755103,0.25,0.1666666666666666,0.1999999952000001,0.25,0.125,0.1666666622222223,0.25,0.0909090909090909,0.1333333294222223,0.25,0.0714285714285714,0.1111111076543211,0.25,0.0526315789473684,0.0869565188657846,0.25,0.0833333333333333,0.1249999962500001,0.25,0.0909090909090909,0.1333333294222223,0.25,0.0555555555555555,0.0909090879338843,0.25,0.0909090909090909,0.1333333294222223,0.25,0.125,0.1666666622222223,0.25,0.1666666666666666,0.1999999952000001,0.25,0.0833333333333333,0.1249999962500001,0.25,0.0909090909090909,0.1333333294222223,1,external,1,"['reading triggering posts', 'being in a harmful community']","['reading through posts that promote self-destruction', 'feeling triggered by community posts']","['reading posts about self-destruction', 'seeing posts with a lot of reblogs/likes']",1,reading posts about self-destruction and competitiveness,reading posts about self destruction and unhealthy behaviors,reading posts about self-destructive behaviors triggering feeling of guilt and competition,1,"['reading posts in a horrible community', 'making a post about unhealthy behavior and weight loss']","reading posts about self-destructive behavior and seeing reblogs and likes, making a post about reaching GW by eating very little calories","['reading through old posts', 'seeing posts that are pro-anorexia', 'feeling triggered by the posts']",1,"['reading harmful posts', 'community promoting self-destruction', 'making harmful post', 'seeing reblogs, likes']","['reading posts about self-destruction', 'seeing posts with high reblogs/likes', 'making a post about unhealthy thing', 'competitive feeling', 'feeling of guilt', 'self-depreciation']","['reading through triggering posts', 'contributing to a community full of self-destruction']",4
10ee8p5,"I have BED and when I start restricting and my face is the first place people will notice. I have have naturally high and prominent cheekbones, which are ""trendy"" right now, and my mom and friends won't stop telling how ""pretty"" I look these days.
 
 Of couser thats nice to hear, the jokes about Bella hadid cheeks put my God complex through the roof!!
 But at the end of the day, I'll come back home, read another article on how ""heroin chic"" is back, write critiques about about how goddam harmful this thinking is to young women everywhere, while I skip yet again another meal. I am a hypocrite. And feel like I have no control over my own brain.
 
 I study social comunnications and sociology but can't help but hate myself for falling for the very phenomenomena I study. I know it's wrong, I know it's harmful, my body is giving me signs its starting to giving up on me these days.
 
 I feel guilty.","Getting compliments when they start restricting, Feeling hypocritical because they study these problems",0.0,0.0,0.0,0.0,0.0,0.0,0.0,0.0,0.0,0.0,0.0,0.0,0.0,0.0,0.0,0.0833333333333333,0.1666666666666666,0.1111111066666668,0.0,0.0,0.0,0.0,0.0,0.0,0.0,0.0,0.0,0.0,0.0,0.0,0.0,0.0,0.0,0.0,0.0,0.0,0.0,0.0,0.0,0.0833333333333333,0.1666666666666666,0.1111111066666668,0.0,0.0,0.0,0.0,0.0,0.0,1,"external, internal",1,"['restricting', 'being complimented for weight loss/appearance']","['restricting', 'mom and friends complimenting her appearance']","['restricting food intake', 'pressure to have trendy features']",1,people complimenting writer on high cheekbones and trendy look,"['mom and friends telling her she looks pretty due to prominent cheekbones', 'articles about ""heroin chic"" being back']",people telling writer they look pretty,1,"['mom and friends commenting about cheekbones', 'reading articles on ""heroin chic"" and criticizing it', 'skipping meals']","['people commenting on high cheekbones and trendy look', 'reading articles on ""heroin chic"" and harmful thinking', 'skipping meals', 'body giving signs of giving up']","['mom and friends constantly complimenting cheekbones', 'articles about ""heroin chic""', 'skipping meals']",1,"['people complimenting her on her appearance', 'articles on ""heroin chic"" and body ideals']","['comments from mom and friends about looking pretty', 'articles about ""heroin chic"" being trendy', 'skipping meals']","['comments on high/ prominent cheekbones', 'articles promoting ""heroin chic""', 'studying communication/sociology']",4
10e4an6,"As a kid I always wanted to be taller. I figured I could eat more and weigh more but be slimmer. 
 Now I want to be shorter. I would be happy being a normal weight if it was low bc I'm so small. Idk what's wrong with me but for years I've just wanted to look like a child. 
 
 But, I do think I stunted my height a bit. With calculations I predicted I should be taller than my mum. She's quite tall but I'm just average height. 
 
 Not to mention my boyfriend is only a little bit taller than me, but I wish there was more of a difference because I was smaller.","Unhappy with weight, wishes they were shorter",,,,,,,,,,,,,,,,,,,,,,,,,,,,,,,,,,,,,,,,,,,,,,,,,1,internal,0,,,,0,,,,0,,,,0,,,,0
10do1eh,"Im so scared omg, i lie to my doctor saying im in recovery, while im obviously not. I lie because its the only way i'll ever be able to get adhd meds and i kinda have no choice... Next week my gp wants to do blood tests on me to ""prove"" that im in recovery, is there any way i could fake this or somehow make it seem that i eat normally? 
 
 
 I TRULY have no choice, these adhd meds are so vital to my future that if i can't get them i'll have to start doing drugs instead to self medicate, so being found out is not an option
 
 Im at an obese bmi, i take multivitamins twice a day and iron supplements, nothing about me scream restrictive ED, Im just an idiot for being honest with my doctors...",,,,,,,,,,,,,,,,,,,,,,,,,,,,,,,,,,,,,,,,,,,,,,,,,,0,,1,['doctor not prescribing ADHD meds without proof of recovery'],"['need to get adhd medication', 'fear of not getting medication']","['gp wants to do blood tests on me to ""prove"" that im in recovery', 'being found out is not an option']",1,need to fake recovery to get adhd meds,doctor wanting proof of recovery,need to pass blood tests to continue medication,1,need to lie to doctor to get medication,need to lie to doctor to continue ADHD medication,"['fear of not being able to get adhd meds and having to resort to drugs instead', 'need to fake blood tests to prove recovery']",1,"['fear of not getting adhd medication', 'need to lie to doctor', 'need to fake recovery for blood test']",['need for ADHD meds'],"['trying to get medication', 'pressure to appear recovered']",4
10dig38,"So when I first started really leaning into my eating disorder I was around 230 pounds. I've lost about 55 pounds since then, and even now I already have so much loose skin, particularly around my stomach. I just want to sob. I'm trying not to be so hard on myself since I'm in ED recovery, I'm trying to be neutral about my body, but it's so fucking hard.
 
 My mom doesn't know about my ED, and as her way of comforting, she said that once I ""hit a weight I'm happy with"" I can ask about skin removal. In her defense, she did lose 200 pounds (in a healthy way) and the insurance paid for her excess skin removal since it was causing her rashes. I just hate looking at myself so fucking much. I'm wearing shape wear just so my pants look semi okay. I hate this I hate this so much.",Having loose skin because of weight loss,0.1428571428571428,0.1111111111111111,0.1249999950781251,0.5714285714285714,1.0,0.7272727226446282,0.4285714285714285,0.75,0.5454545408264463,0.4285714285714285,0.5,0.4615384565680473,0.4285714285714285,0.6,0.499999995138889,0.2857142857142857,0.2222222222222222,0.249999995078125,0.2857142857142857,0.4,0.3333333284722222,0.2857142857142857,0.4,0.3333333284722222,0.2857142857142857,0.2222222222222222,0.249999995078125,0.2857142857142857,0.5,0.3636363590082644,0.2857142857142857,0.25,0.266666661688889,0.4285714285714285,0.3333333333333333,0.374999995078125,0.5714285714285714,1.0,0.7272727226446282,0.4285714285714285,0.6,0.499999995138889,0.2857142857142857,0.4,0.3333333284722222,0.4285714285714285,0.5,0.374999995078125,1,internal,1,"['mom suggesting skin removal', 'feeling uncomfortable in own body']","['weight loss', 'loose skin']","['losing weight', 'loose skin']",1,excess skin caused by weight loss,loose skin after losing weight,not feeling comfortable with body due to loose skin,1,"['loose skin', 'mom mentioning skin removal']","['loose skin', 'mom suggesting skin removal']","['loose skin around stomach', ""mom's comment about excess skin removal""]",1,"['loose skin', ""mom's comment""]","['loose skin', 'mom talking about skin removal', 'body image']","['loose skin', ""mom's comment about weight"", 'wearing shape wear']",4
10d3p3i,"it always starts small, you limit this then you limit that. just little restrictions, but they add up. at the start i was grateful for my dedication, i thought to myself ‚Äö√Ñ√≤i‚Äö√Ñ√¥ve been so patient and now i‚Äö√Ñ√¥m getting the reward of weight loss!‚Äö√Ñ√¥ 
 i realise now the ‚Äö√Ñ√≤dedication‚Äö√Ñ√¥ was me slowly allowing the ed to fill all the gaps in my brain. i don‚Äö√Ñ√¥t even know where i would start with recovery, my hole world is based on my ed. i watch food videos on youtube, my tiktok fyp is full of wieiads, my instagram following all those stupid fitness influencers that post their infographics. fuck man, why can‚Äö√Ñ√¥t i wake up tomorrow and be better? i don‚Äö√Ñ√¥t care about myself enough to work to heal myself. fml","food videos, tiktok, instagram influencers making user feel whole world is about ed",,,,,,,,,,,,,,,,,,,0.2307692307692307,0.2727272727272727,0.2499999950347222,,,,,,,,,,,,,,,,,,,,,,0.2307692307692307,0.2727272727272727,0.2499999950347222,,,,1,internal,0,,,,0,,,,1,"['watching food videos on youtube', 'tiktok fyp', 'instagram following fitness influencers']",,,0,,,,1
10czqc3,"I work as a cashier and spend hours surrounded by snack foods. I mustered up the courage to get a small snack because my body was absolutely begging for something. I‚Äö√Ñ√¥m minding my own business and alone at the register only to be told I can‚Äö√Ñ√¥t eat while I‚Äö√Ñ√¥m working‚Äö√Ñ¬∂ 
 Took me an hour to say it‚Äö√Ñ√¥s okay to have something small and here we are lmao. 
 I‚Äö√Ñ√¥m part time so I don‚Äö√Ñ√¥t get a lunch and I work by myself so much that I can‚Äö√Ñ√¥t even fit in a 15 minute break. Customers don‚Äö√Ñ√¥t give a fuck if I‚Äö√Ñ√¥m eating?",,,,,,,,,,,,,,,,,,,,,,,,,,,,,,,,,,,,,,,,,,,,,,,,,,0,,1,"['being told not to eat while working', 'lack of break time for eating']","['being told not to eat while working', 'lack of break time']","['being told not to eat while working', 'lack of break time and limited time to eat']",1,being told not to eat while working surrounded by snack foods,forbidden from eating while working,being told they cannot eat while working,1,being told not to eat while working,being told she can't eat while working despite being a part-time worker who doesn't get a lunch break and can't fit in a 15 minute break,getting told not to eat by employer,1,"['forbidden to eat snack while working', 'no proper break time']","['being told not to eat while working', 'not getting breaks']",['being told not to eat while working'],4
10c9jli,"for me it‚Äö√Ñ√¥s when i worked at starbucks and none of my coworkers ever saw me eat and i became known as ‚Äö√Ñ√∫the americano girl‚Äö√Ñ√π bc that‚Äö√Ñ√¥s all i‚Äö√Ñ√¥d take w me on my break. so the holiday season rolls around and as we‚Äö√Ñ√¥re stocking the seasonal bakery items, one of the girls divides a sugarplum danish and cranberry bliss bar into fours (the amount of ppl closing that shift) for each of us to try. they call me over and i politely say ‚Äö√Ñ√∫oh no, i‚Äö√Ñ√¥m good thanks.‚Äö√Ñ√π this vague rejection is the best way i‚Äö√Ñ√¥ve found to turn down food with no further questions. anyway, i stand there silently watching them all eat their piece and rate their favorite. and you could just feel in the air, something conveyed purely through body language and glances, they were all thinking to each other ‚Äö√Ñ√∫oh. she has an eating disorder.‚Äö√Ñ√π and they could all tell i was thinking ‚Äö√Ñ√∫yup.‚Äö√Ñ√π",,,,,,,,,,,,,,,,,,,,,,,,,,,,,,,,,,,,,,,,,,,,,,,,,,0,,1,"['worked at Starbucks', 'coworkers never saw me eat']","['being at Starbucks', 'being pressured to eat']",being confronted with food in a social setting,1,coworkers offering food,,coworkers offering food,1,coworkers assuming the writer has an eating disorder,being offered bakery items by coworkers,coworkers dividing bakery items and noticing the writer never eats,1,"['coworkers not seeing me eat', 'holiday season', 'rejection of food offer']","['coworkers not seeing writer eat', 'being labeled as ""the americano girl""', 'coworkers offering danish and bliss bar', 'coworkers noticing writer has eating disorder']","['being known as the ""americano girl""', 'coworkers offering food', 'body language and glances']",4
10bs3lh,"My highschool friends and I have agreed to go on a trip this year. Unfortunately, all of them except for me want to go to a beach area. They're all extremely slim, like size 0s. 2 of them were literal models. I am admittedly large at a size 10-12. I can already imagine how humungous I'm going to look alongside them in the photos.
 
 I know I'm going to get comments telling me to just love myself and ""rock that body"", but I would actually rather die than wear a swimsuit alongside them. I've tried gently suggesting we go to a city or something but they're all hell-bent on the beach.
 
 Does anyone have advice on how I can excuse myself to avoid having to wear one? If not, I'll just have to make an excuse not to go.",feels uncomfortable with their body size and doesn't want to go to the beach,0.0,0.0,0.0,0.1538461538461538,0.1,0.1212121164370984,0.5384615384615384,0.2592592592592592,0.3499999956125,0.2307692307692307,0.2307692307692307,0.2307692257692309,0.0769230769230769,0.2,0.1111111070987655,0.2307692307692307,0.2727272727272727,0.2499999950347222,0.4615384615384615,0.4285714285714285,0.4444444394513032,0.3076923076923077,0.2,0.2424242376492195,0.2307692307692307,0.3,0.2608695603024575,0.3076923076923077,0.2,0.2424242376492195,0.3076923076923077,0.1739130434782608,0.2222222176080247,0.3076923076923077,0.5,0.3809523762358277,0.5384615384615384,0.2592592592592592,0.3499999956125,0.2307692307692307,0.2727272727272727,0.2499999950347222,0.4615384615384615,0.4285714285714285,0.4444444394513032,0.3076923076923077,0.5,0.3809523762358277,1,external,1,"['seeing her slim friends', 'feeling humungous in photos']","['comparing herself to her friends who are all extremely slim', 'feeling humungous and embarrassed in photos when wearing a swimsuit']","['going on a trip with high school friends, all of whom are extremely slim', 'going to a beach area where the writer feels self-conscious about her size 10-12 body']",1,friends planning a beach trip and being self-conscious about appearance compared to them,friends planning a beach trip,friends wanting to go to a beach despite being larger than them,1,"['being the only one with a larger size', 'friends wanting to go to beach area']","['planned trip with friends to beach area', 'friends are all extremely slim, size 0', 'self-comparison', 'fears of being humungous in photos']",planned trip with extremely slim friends to a beach area,1,"['going on a trip with slim friends', 'being size 10-12 in comparison', 'going to a beach area', 'fear of looking large in photos']","['going on a trip with highschool friends', 'friends wanting to go to a beach area', 'friends being model-like slim', 'feeling humungous', 'not wanting to wear a swimsuit', 'not wanting to be in photos']",['upcoming trip to the beach with slim friends'],4
10981nj,"Today I am going to try and eat a whole bagel with spread at lunch time. I have been eating bagel halves as part of my meals and I think I can do it now. This past week I've been eating the second half with spread for a snack, so that way the whole bagel is ""in me"" (I struggle with ARFID as well due to GI disorder history).
 
 So today I'm going to see if I can eat the whole thing! And if it feels like too much at the time I packed extra food that would make up for it otherwise.
 
 And it will be OK. Bagels have carbs, and proteins, and even fiber! I'm not going to get sick because I ate a bagel. And if I'm full I won't be full forever. The feeling will pass.",,,,,,,,,,,,,,,,,,,,,,,,,,,,,,,,,,,,,,,,,,,,,,,,,,0,,0,,,,0,,,,0,,,,0,,,,0
108sqlo,For the past year my Ed has been at its all time low. Everyday I do something that makes me thing I‚Äö√Ñ√¥m genuinely not going to wake up the next day. Then 2023 hit and I‚Äö√Ñ√¥m just like confused. Like I‚Äö√Ñ√¥m still here? How? And so is my Ed? I really thought it would kill me or I would recover. Neither are happening and the new year kind of woke me up to that. I guess it‚Äö√Ñ√¥s just something I‚Äö√Ñ√¥ll learn to live with? Does anyone else feel like this?has anyone had an ed for a while and can speak on this? I feel weird,,,,,,,,,,,,,,,,,,,,,,,,,,,,,,,,,,,,,,,,,,,,,,,,,,0,,1,"['the passage of time (2023)', 'feeling confused']",,"['New Year', 'Ed not killing or recovering']",1,realization of ED still being present in the new year,,,1,,realizing ED is still present in the new year,,0,,,,3
108l9hj,"So, since relapsing I have been restricting very heavily pretty much every day for 6 months (with a few vodka sodas most days). This morning I woke up after sleeping a solid 3 hours (typical for me) drenched in sweat and shaking. I couldn‚Äö√Ñ√¥t get out of bed or stand for more than a few seconds without feeling extremely, uncomfortably hot and feeling my vision start to go dark. My body temp was ranging from 94.8-96. My partner was worried about sepsis (I had all the symptoms but no pain). He urged me to call the doctor but I was having a hard time putting sentences together. This went on for hours. It was terrifying. 
 
 This is going to sound so fucking asinine, but I was starving, so I forced myself to eat something. Within maybe 20 minutes, I felt like 75% better. Then I started craving sugar. Like, BADLY. And I never want/eat sweets. Now I‚Äö√Ñ√¥ve eaten a salad, a yogurt, two chocolate bars and some berries and I feel like a thousand bucks. And I want more. What in the actual fuck am I doing to myself?! My poor partner was worried sick and ready to take me to the ER because he thought I had blood poisoning. And I was just hungry. Just. Fucking. Hungry. I‚Äö√Ñ√¥m done with this ED.","Not eating which resulted in sweating, shaking, and high body temperatures",0.0,0.0,0.0,0.0,0.0,0.0,0.0909090909090909,0.0833333333333333,0.0869565167485825,0.0,0.0,0.0,0.0909090909090909,0.1428571428571428,0.1111111063580248,0.0909090909090909,0.1666666666666666,0.1176470542560555,0.0,0.0,0.0,0.0,0.0,0.0,,,,0.0909090909090909,0.0588235294117647,0.0714285666581635,0.0,0.0,0.0,0.0,0.0,0.0,0.0909090909090909,0.0833333333333333,0.0869565167485825,0.0909090909090909,0.1666666666666666,0.1176470542560555,0.0,0.0,0.0,0.0909090909090909,0.0588235294117647,0.0714285666581635,1,external,1,"['restriction', 'heavy alcohol consumption']","['heavy restriction', 'lack of nutrition']","['restriction and heavy drinking for 6 months', 'feeling hot and vision going dark']",1,severe physical symptoms,severe physical symptoms of prolonged eating disorder,prolonged heavy restriction and inadequate nutrition,1,severe hunger,severe physical symptoms,,1,"['sepsis scare', 'feeling extremely hot', 'vision going dark', 'partner urging to call a doctor', 'satisfaction from eating']","['sepsis scare', 'feeling extremely hot', 'vision going dark']","['extreme hunger', 'symptoms of sepsis']",4
108i2ea,"So, im in my third year of highschool. My grades are a mess and I'm failing two classes. I feel worthless cause I'm supposed to be the ""smart one"" in the family and they place a lot of importance on it.
 
  I lost my appetite or well I was just way to lazy to put any energy into eating. Tbh I didn't even realize how little I was eating because for the first time in a while I wasn't tracking anything. I just felt way to damn tired and cyncial to do it. I had a nothing matters mindset and just wallowed, sometimes I ate a little of dinner, but after realizing how much I was eating (and how much less it is than I usually eat) I've stopped eating entirely and decided to just take advantage of it instead.
 
 I couldn't use to go days without eating cause I usually binge when I heavily restrict or try fasting, but weirdly enough I haven't ate anything for maybe a few days now. I have not been keeping track.
 
 I feel like shit and probably look like it, but I also feel happy cause it feels like I have a lot of control and it's the one thing I'm doing right. Basically, it's a good distraction and I'm leaning into it. It's either this or sh and I can't do that.
 
 I'm probably gonna eat everything in my house once this passes but at least I feel better even if it's just a little bit.",school is causing the writer to lose track of eating,,,,,,,,,,,,,,,,,,,,,,,,,,,,,,,,,,0.0,0.0,0.0,,,,,,,,,,0.0,0.0,0.0,1,external,0,,,,0,,,,0,,,,1,,,"['failing two classes', 'placed importance on grades by family', 'feeling worthless', 'nothing matters mindset']",1
1080d3d,"I acknowledge that right now with the stress of college and work, I can‚Äö√Ñ√¥t recover. I‚Äö√Ñ√¥ve tried and failed multiple times. I don‚Äö√Ñ√¥t want this, I don‚Äö√Ñ√¥t even want to be skinny. I actually like my healthy body. I need control. The thing is, I look through my camera roll and get so sad bc the past year ALL I have been doing is obsessing over food, my body, etc. I lived alone for the year and literally didn‚Äö√Ñ√¥t see anyone. I stopped doing fun things, quit my job, did all my classes online, didn‚Äö√Ñ√¥t go to festivals and concerts I already paid for, the list goes on.
 
 Does anyone have advice on how to get out of your head and at least try to live a little? If not have fun at least like go to work? I can‚Äö√Ñ√¥t do this anymore and the more I think about it the more guilty I feel for letting a whole year slip away. I‚Äö√Ñ√¥m 23 i feel too old to be obsessing over this. I spent my whole 22ns year alone and hating myself when there‚Äö√Ñ√¥s nothing about me I should hate.",stress of college and work,,,,,,,,,,,,,,,,,,,,,,,,,,,,,,,,,,,,,,,,,,,,,,,,,1,external,0,,,,0,,,,0,,,,0,,,,0
