p9cuf0,"In fact I think my ED might have become a coping mechanism to deal with the loneliness it created. I haven‚Äö√Ñ√¥t had any friends in over 8 years (not even acquaintances) and at my age, it often feels difficult to start anew considering the only social spaces left are either bars, volunteerism, or work but even with that, I forgot how to socialize since I no longer feel like I have a personality at times.
 
  Idk if I‚Äö√Ñ√¥m rambling but sometimes the loneliness makes me feel pathetic and slightly miss my ED as it was some masochistic companion I had to hold on to. Without it, some days I feel even more boring to myself since my thoughts no longer revolve around food and calories anymore. So how do you cope with the loneliness or what have you done to ‚Äö√Ñ√∫put yourself out there‚Äö√Ñ√π and reconnect to the world?
 
 Btw, I am happily married so at least I do have one person in my life but of course one can‚Äö√Ñ√¥t revolve life around a husband either so what can I do? Sometimes I feel like there‚Äö√Ñ√¥s nothing left.",loneliness,,,,,,,,,,,,,,,,,,,,,,,,,,,,,,,,,,,,,,,,,,,,,,,,,1,internal,0,,,,0,,,,0,,,,0,,,,0
p7varf,"got referred to, assessed &amp; recommended PHP or residential by a treatment center 1.5 weeks ago, no diagnosis. but my own insurance wants to assess me before agreeing to cover anything higher than their own program, which is just having a team and weekly sessions.
 
 I moved back home today &amp; bc of my parents and possibly returning hunger, I can't maintain this LW &gt;!low 16s BMI which personally is destructive on my body!&lt; 
 
 I'm scared I'll gain weight before the insurance assessment, get put in a low level of care as a result, never really get the mental treatment I need, and then return to college &amp; relapse. *I* know that weight doesn't define the severity of an ED but I don't trust others to know. Im so tired of mental health professionals letting me down I just don't know what else to do","parents, recurring hunger",0.0,0.0,0.0,0.0,0.0,0.0,0.0,0.0,0.0,0.0,0.0,0.0,0.0,0.0,0.0,0.3333333333333333,0.2,0.2499999953125,0.3333333333333333,0.04,0.0714285695153061,0.3333333333333333,0.0384615384615384,0.0689655153864447,0.0,0.0,0.0,0.3333333333333333,0.0526315789473684,0.090909088553719,0.3333333333333333,0.125,0.1818181778512397,0.3333333333333333,0.125,0.1818181778512397,0.0,0.0,0.0,0.3333333333333333,0.2,0.2499999953125,0.3333333333333333,0.04,0.0714285695153061,0.3333333333333333,0.125,0.1818181778512397,1,"external, internal",1,"['moved back home', 'concerns about weight gain']","['moved back home', 'insurance assessment']","['moved back home', 'insurance assessment']",1,"['insurance wants own assessment before covering higher treatment level', 'scared of gaining weight before assessment']","['insurance wants to assess coverage before agreeing to PHP/residential programs', 'moved back home']",parents and possibly returning hunger,1,"['moved back home with parents and increase in hunger', 'being apprehensive of gaining weight before getting insurance assessment and losing out on appropriate mental health treatment.']","['insurance assessment for higher level of care', 'moved back home', 'returning hunger', 'fear of gaining weight', 'low level of care', 'returning to college and relapse', 'lack of trust in mental health professionals']","['moving back home', 'risk of gaining weight', 'insurance assessment']",1,"['moving back home with parents', 'returning hunger', 'insurance covering only their own program', 'fear of gaining weight before assessment']","['insurance assessment', 'moving back home', 'parents', 'returning hunger']","['insurance assessment', 'moving back home', 'parents', 'returning hunger']",4
oww5oc,"I truly believe that if you restrict your food intake for a long time, even when weight is restored, your body still needs to feel full in order to regulate all of the bodily mechanisms/being normal again. Maybe it's because I'm 18M and still shorter than my dad after 1.3 years of calorie restriction/aka restriction against feeling full. Maybe my body wants to be at a higher weight in order to function optimally and continue my growth spurt. idk. All I know is that in order to be normal, whether weight restored or not, YOU NEED TO EAT TO SATIETY, because if you don't (even if you think you're eating more than enough) you're not, and your body is crying for more food.",,,,,,,,,,,,,,,,,,,,,,,,,,,,,,,,,,,,,,,,,,,,,,,,,,0,,0,,,,0,,,,0,,,,0,,,,0
ou7qo7,"Fuck you anorexia ! You took away my hair. You took away my curves. You took away my social life, my joy, my enthusiasm, my passions- fucking everything but I can‚Äö√Ñ√¥t believe I‚Äö√Ñ√¥ve done the impossible today and felt not guilt, not a caloric calculator but absolute FREEDOM and literal pleasure in eating . 
 
 Omg I‚Äö√Ñ√¥m only 2 months into recovery but cannot believe how amazing this feels - to eat without a single calorie count going on in my mind . WOOOHOOO to 2 months in ! I know it‚Äö√Ñ√¥s a long road ahead but the energy I feel today is insane and I can‚Äö√Ñ√¥t imagine how much more I‚Äö√Ñ√¥ll have if I keep this up . Good luck and joy to all of you on the journey !",,,,,,,,,,,,,,,,,,,,,,,,,,,,,,,,,,,,,,,,,,,,,,,,,,0,,0,,,,0,,,,0,,,,0,,,,0
oo9cgs,"Hi everyone, so during quarantine I did the dumbest thing a 17 year old boy can do, I lost weight REAL fast. I was bigger, but not fat in track and field, so I wanted to lean out for the next season and the coronavirus was happening so I realized that I could use that time to lose some weight. And I did. I was eating very little calories for an extended period of time, I lost about 30ish(175-178 ish to 147-151)or more pounds from mid March to August 2020. 
 
 The difference: [https://imgur.com/a/o5px3tH](https://imgur.com/a/o5px3tH)
 
 My knees became knobby, I looked really really skinny. I was always hungry, I didn't care about anything other than nutrition and I didn't even talk to any of my friends. I noticed that I didn't have any urge to masturbate or talk to girls, which wasn't rly a problem to me at the time because of corona. I noticed my facial hair under my chin didn't grow at all until a few months ago. I was kinda cold and had night sweats. I was Eating about like 1800 to 2300 max while in pre-season track and field took a hit on my body and my hamstring pulled, causing me to not compete at my best ability. By march 2021, I started reverse dieting and gradually reached 3200 calories by mid April(which still wasn't enough for a teen athlete). When we went back to school, I started interacting with other students and realized my personality completely changed. I felt like I was under them(which is ironic because before I felt I was the guy subconsciously). I had more social anxiety, my voice got lighter, and didn't have the flow of conversation anymore. That's when I realized I did something really wrong, which lead me to think I dramatically decreased my test levels. I started looking up the importance of fats in a diet and how low calorie diets lead to low testosterone and GH, and that broke me. I always wanted to develop and grow into a man and I was finally getting there before losing weight and dieting. My dad is about 6'2 and my mom is 5'8 (maybe 5'7)and I was my mom's height by the end of eight grade. I was 5'10.4 by Feb. 2020(junior year) and I really feel I was supposed to have gotten a growth spurt during this time. Unfortunately, I only grew an inch since this period(5'11.5), despite losing so much weight. As a guy, I severely underestimated the caloric needs of a young 17-18 year old male. I look even younger than I did in the early stages of the weight loss. (I'm about 171 ibs now and I feel alot better, but still not completely there hormonally)
 
  I know this is kind of a rant, but is there any chance that once I fully recover from this that my body will rapidly catch up developmentally to confiscate for the delayed development and maturity? Did this one year and a few months permanently take a few inches of my growth potential? Any help is needed, looking back on this situation really makes me feel defeated.",going on an extreme calorie-deficit diet,0.0,0.0,0.0,,,,0.0,0.0,0.0,0.0,0.0,0.0,0.0,0.0,0.0,0.0,0.0,0.0,,,,0.0,0.0,0.0,0.0,0.0,0.0,0.0,0.0,0.0,,,,,,,0.0,0.0,0.0,0.0,0.0,0.0,0.0,0.0,0.0,0.0,0.0,0.0,1,internal,1,"['Desire to lean out for track and field season', 'Coronavirus quarantine providing opportunity to lose weight']",,"['quarantine', 'desire to lean out for track and field season']",1,"['wanting to lean out for track and field season', 'coronavirus quarantine']",quarantine,"COVID-19 quarantine period, desire to lean out for next track and field season",1,,"['quarantine', 'pre-season track and field', 'desire to lean out', 'underestimation of caloric needs']","['quarantine', 'desire to lose weight for track and field', 'subconsciously feeling under peers', 'realization of side effects of dieting']",1,"['quarantine', 'pre-season track and field', 'social anxiety', 'concerns about hormone levels']",,,4
okzln4,"TW: mentions of diets, eating behaviours, swearing.
 
 So I just randomly got a few flashbacks of how people responded to me opening up about my anorexia back when I was so deep up in it and I just can NOT believe how blinded people are by diet culture. They literally tried to ‚Äö√Ñ√∫help‚Äö√Ñ√π me by proposing DIET SHIT ALTERNATIVES instead of telling me I didn‚Äö√Ñ√¥t even need to lose weight to begin with. Now I don‚Äö√Ñ√¥t know about you, but those things were the LAST things I needed to hear and I don‚Äö√Ñ√¥t think anyone struggling with anorexia should be offered ways to perpetuate this form of self-harm only in ‚Äö√Ñ√∫safer‚Äö√Ñ√π and socially more accepted ways. Some of you may tell me: ‚Äö√Ñ√∫yeah well most people don‚Äö√Ñ√¥t know how to respond to eating disorders‚Äö√Ñ√π / ‚Äö√Ñ√∫they were just trying to help‚Äö√Ñ√π and I agree to an extent. But I am so angry that I didn‚Äö√Ñ√¥t even recognise that they were participating in perpetuating my self-hatred and spiral down anorexic behaviours and glorification. 
 
 I often read on the internet that ‚Äö√Ñ√≤diet culture is everywhere‚Äö√Ñ√¥ and now I finally understand. Telling an anorexic about YOUR diet routine and ways you approach it IS NOT the right answer to someone literally disappearing physically and mentally from themselves. Telling an anorexic that they didn‚Äö√Ñ√¥t even ‚Äö√Ñ√∫EAT THAT MUCH‚Äö√Ñ√π is NOT the right answer either. 
 
 Society and media have made it ‚Äö√Ñ√≤normal‚Äö√Ñ√¥ and totally acceptable to TRACK DOWN one‚Äö√Ñ√¥s food intake, set unhealthy fitness goals and push one‚Äö√Ñ√¥s self to look like someone they are not. 
 
 Well, I don‚Äö√Ñ√¥t know about you guys, but personally speaking, it drives me fucking insane. So here, I‚Äö√Ñ√¥ll say it to my past self and to whoever needs to hear this / agrees with me: TRACKING YOUR FOOD INTAKE, BEING OBSESSIVELY MINDFUL OF YOUR BODY AND LOOKS, RESTRICTING, ‚Äö√Ñ√≤INTERMITTENT FASTING‚Äö√Ñ√¥ (which is but another name for starvation), BANNING FOODS, SKIPPING MEALS and so on and so forth IS NOT NORMAL. 
 
 You wanna know what‚Äö√Ñ√¥s normal? You wanna know what YOU deserve?? You deserve to live your life FULLY, UNBOTHERED by such a NATURAL AND ABSOLUTELY NECESSARY TO SURVIVE ACT AS EATING. You deserve to ENJOY your food, YES EVEN THE ONES THAT ARE NOT ‚Äö√Ñ√≤HEALTHY‚Äö√Ñ√¥. You deserve to ANSWER AND HONOR your hunger cues (WHETHER THEY ARE MENTAL OR PHYSICAL). You deserve to TAKE CARE OF YOUR HEALTH but always REASONABLY and not obsessively and destructively. 
 
 Your body is the way that it is for so many fucking reasons. Thinking you should look a certain way is literally the most deranged thing society has ever succeeded to make us believe. Thinking you should eat a certain way and amount is fucking dumb as well. Jesus Christ we are talking about FOOD. The second thing that keeps us alive after water. Don‚Äö√Ñ√¥t you think it‚Äö√Ñ√¥s much better if you can enjoy it??? ALLOW YOURSELF. ALLOW IT ALL.
 
 And for all those people who thought they were helping but were just reflecting back my insecurities and diet culture: FUCK YOU. Fuck you. Fuck you. And I‚Äö√Ñ√¥m sorry you are so fucking blind you literally perpetuated deadly shit on someone because you thought you were helping. This is just about how dangerous diet culture is. Fuck this, man.",other people proposing diet shit alternatives,0.1666666666666666,0.0555555555555555,0.0833333295833335,0.6666666666666666,0.3076923076923077,0.4210526272576177,,,,0.6666666666666666,0.4444444444444444,0.5333333285333334,0.6666666666666666,0.4,0.4999999953125,0.6666666666666666,0.4444444444444444,0.5333333285333334,0.3333333333333333,0.2,0.2499999953125,0.3333333333333333,0.1666666666666666,0.2222222177777778,0.3333333333333333,0.2,0.2499999953125,,,,0.1666666666666666,0.2,0.1818181768595042,0.6666666666666666,0.1176470588235294,0.19999999745,0.6666666666666666,0.3076923076923077,0.4210526272576177,0.6666666666666666,0.4444444444444444,0.5333333285333334,0.3333333333333333,0.2,0.2499999953125,0.6666666666666666,0.2,0.19999999745,1,external,1,"['Telling an anorexic about YOUR diet routine and ways you approach it', 'Telling an anorexic that they didn‚Äôt even ‚ÄúEAT THAT MUCH‚Äù']","['proposing diet shit alternatives', 'telling writer they didn‚Äôt even need to lose weight']",,1,people proposing diet alternatives as a solution to anorexia,flashbacks of people proposing diet alternatives to help with anorexia,people proposing diet alternatives as a way of helping,1,flashbacks of people suggesting diet alternative while recovering from anorexia,"['flashbacks of how people responded to opening up about anorexia', 'diet culture']",people responding with diet culture to opening up about anorexia,1,,['people suggesting diets as solution'],"['people proposing diet alternatives', 'tracking food intake', 'unhealthy fitness goals', 'pushing for a certain body type', 'restricting, ‚Äòintermittent fasting‚Äô (which is but another name for starvation), banning foods, skipping meals', 'society and media promoting diet culture']",4
nqxojm,"Hi guys! I‚Äö√Ñ√¥m feeling very positive about my recovery right now. 
 
 My 12 hour night shift last night I felt sick and hungry and ate a lot more than usually I would want. 
 
 I woke up today around noon after my sleep and had a big bowl of protein baked oats, went on a 2 hour walk outside and then made a delicious dinnner. I feel so good, I‚Äö√Ñ√¥m satisfied, I didn‚Äö√Ñ√¥t count calories at all and don‚Äö√Ñ√¥t feel the usual anxiety and guilt after I ate. I actually feel kinda empowered and happy. I haven‚Äö√Ñ√¥t been looking at myself in the mirror and just focusing on feeling good. 
 
 I‚Äö√Ñ√¥m just really happy? It‚Äö√Ñ√¥s been a while since I either haven‚Äö√Ñ√¥t counted calories, restricted or felt extreme guilt and anxiety. I‚Äö√Ñ√¥m just having a big win.",,,,,,,,,,,,,,,,,,,,,,,,,,,,,,,,,,,,,,,,,,,,,,,,,,0,,0,,,,0,,,,0,,,,0,,,,0
nmej55,"I was anorexic bulimic for over a month but now I'm on my 3rd day of recovery and I have been eating 3 full meals for the past 2 days. For example for breakfast I had eggs, hummus, beans, tomatoes, cucumbers, potatoes, carrots, watermelon and cherries basically I tried including protein in almost every meal I have. I'll be having a roasted chicken thigh with roasted vegetables and hummus for lunch. I wasn't able to workout during my anorexia but during my recovery I was able to go on walks/runs. My period was supposed to come a few days ago but it didn't and I know it's because of my past undereating I'm just wondering when I'll be able to get it back and what are some helpful tips that can help speed up the process of getting it back faster.
 
 P.s look at my previous posts for more info of my body before and during anorexia I have gone back to a normal weight I did lose weight quickly then and became thin and slender but now I'm just thin and slim",,,,,,,,,,,,,,,,,,,,,,,,,,,,,,,,,,,,,,,,,,,,,,,,,,0,,0,,,,0,,,,0,,,,0,,,,0
nl3x78,"So I've been recovering for 3 years. But it's only really been the last year (just under) that I've been gaining weight. 
 At first I was scared of getting fat but now it's completely different. 
 It's the opposite of my old anorexic thoughts but they are just as destructive and drive me insane. 
 I'm constantly feeling like I have a masculine body, that I don't look feminine enough. I have tiny boobs and hardly any hip or bum. 
 I'm like a rectangle and I beat myself up for it everyday. 
 
 When I was seeing consistent weight gain I was feeling great and never felt bad about my body. But now weight gain has slowed down I'm feeling so bad about myself. 
 
 Always thinking I need bigger boobs. I need to be curvier. 
 
 I'm always telling myself I look like a boy, my face is too masculine, my body is too masculine. 
 
 Some days I can barely look at myself because I don't feel womanly enough. 
 I really think it's body dismorphia but the opposite of what I'm used to because I'm always told I have a long oval face. 
 But when I look in the mirror I see a short square face with a very wide jaw bone. I see masculine features where others don't get what I see. 
 
 I've never heard anyone talk about recovery in this light so I just don't know if I'm alone. 
 
 I'm so fed up of feeling bad about myself I just want these feelings to go away so I can live a normal life. 
 
 I don't know if this is part of anorexia or a type of new eating disorder. I have no idea what's going on because my recovery was going perfect until a a month or even less ago. These thought patterns have turned obsessive.",bad self-image,0.0,0.0,0.0,0.0,0.0,0.0,0.0,0.0,0.0,0.0,0.0,0.0,0.0,0.0,0.0,0.0,0.0,0.0,0.0,0.0,0.0,,,,0.0,0.0,0.0,0.0,0.0,0.0,0.0,0.0,0.0,0.0,0.0,0.0,0.0,0.0,0.0,0.0,0.0,0.0,0.0,0.0,0.0,0.0,0.0,0.0,1,internal,1,slowed down weight gain,slowed weight gain,slowed down weight gain,1,slowed weight gain and feeling like body is too masculine,weight gain slowed down,weight gain has slowed down,1,slowdown of weight gain,,slowing weight gain,1,"['slowed down weight gain', 'feeling like body is masculine', 'lack of feminine physical features']","['slowing down of weight gain', 'body dysmorphia', 'wanting more feminine features']",['slowed down weight gain'],4
n65ai7,"Hi everyone, I have been in recovery for quite some time now but soon I‚Äö√Ñ√¥m turning 18. I‚Äö√Ñ√¥ve always wanted to be a pescatarian and go dairy free because I took a nutrition class in high school and we learned about how cows and chickens are raised before they are killed and sent to stores as food. It made me sad and grossed out, however, I don‚Äö√Ñ√¥t feel this way about fish because my family often catch and cook our own fish, and in my eyes, that‚Äö√Ñ√¥s not bad for the environment. I want to go dairy free to improve my acne and since dairy usually upsets my stomach. 
 
 However, my doctor has refused to let me go pescatarian or dairy free because she believes I need the protein in cows milk and animal products to recovery properly. My parents have also not let me because up till now I‚Äö√Ñ√¥ve been a child and not allowed to make my own decisions. They also say that it‚Äö√Ñ√¥s restrictive. 
 
 I know being pescatarian will give me a better relationship with food and my body, I know once I‚Äö√Ñ√¥m 18 no one can force me to eat what I don‚Äö√Ñ√¥t want to, however, I am afraid my parents will judge me and not be supportive. How can I convince them that this is best for me?",learning how white and red meat are made,,,,,,,,,,,,,,,,,,,,,,,,,0.0,0.0,0.0,0.125,0.0666666666666666,0.0869565172022686,0.0,0.0,0.0,,,,,,,,,,0.0,0.0,0.0,0.125,0.0666666666666666,0.0869565172022686,1,external,0,,,,0,,,,1,,,"['doctor not allowing to go pescatarian or dairy free', 'parents refusing to let writer be pescatarian or dairy free']",1,"['turning 18', 'wanting to be a pescatarian and go dairy-free', 'doctor refusing', 'parents not allowing']","['doctor not letting them have pescatarian/dairy-free diet', 'parental disapproval']",,2
mxryts,"Hey guys, I ate a ton of food today. Which is great! I‚Äö√Ñ√¥ve also stopped my exercise for the day too for extra points. But, I feel really.. how do I put it, gross? Like, I feel really ‚Äö√Ñ√∫chubby‚Äö√Ñ√π and lazy, and I really wanna get up and exercise a bit. I‚Äö√Ñ√¥m basically forcing myself not to, and I know it‚Äö√Ñ√¥s the right thing to do, but it feels so wrong. does anyone know how to deal with this feeling? What do you do to ignore it? It‚Äö√Ñ√¥s so frustrating, it‚Äö√Ñ√¥s like I know I‚Äö√Ñ√¥m doing great but I sure don‚Äö√Ñ√¥t feel like it.",bad self-image,0.0,0.0,0.0,0.0,0.0,0.0,0.0,0.0,0.0,0.0,0.0,0.0,,,,0.0,0.0,0.0,,,,0.0,0.0,0.0,0.0,0.0,0.0,0.0,0.0,0.0,0.0,0.0,0.0,0.0,0.0,0.0,0.0,0.0,0.0,0.0,0.0,0.0,0.0,0.0,0.0,0.0,0.0,0.0,1,internal,1,"['Ate a lot of food', 'Feeling gross and chubby']","['ate a ton of food', 'stopped exercising']",eating a lot of food and feeling gross,1,ate a lot of food and feels gross,,"ate a ton of food and stopped exercise, feeling gross and chubby",1,,overeating and skipping exercise for the day,eating a ton of food,1,"['binging', 'feelings of being lazy', 'urge to exercise after eating', 'insecurity']","['eating a lot of food', 'stopped exercise', 'feeling gross and lazy']",['overeating'],4
m99x84,"My mom constantly makes comments about my brother behind his back (to me) and how he gained weight and she says ‚Äö√Ñ√∫I don‚Äö√Ñ√¥t mean this as a compliment or an insult, it‚Äö√Ñ√¥s just interesting that he‚Äö√Ñ√¥s gained weight‚Äö√Ñ√π and then when I say not to say those things to me she‚Äö√Ñ√¥s like ‚Äö√Ñ√∫he did it on purpose, it‚Äö√Ñ√¥s not healthy to just let yourself go‚Äö√Ñ√π. How about we don‚Äö√Ñ√¥t focus on people‚Äö√Ñ√¥s bodies???? And it‚Äö√Ñ√¥s so obvious she‚Äö√Ñ√¥s lying when she says she doesn‚Äö√Ñ√¥t mean it as an insult. Also, the other day she told me ‚Äö√Ñ√∫this isn‚Äö√Ñ√¥t a good thing or a bad thing but you‚Äö√Ñ√¥re smaller than you used to be‚Äö√Ñ√π JUST SHUT UP PLEASE!! I‚Äö√Ñ√¥ve been in recovery for a year and I have no clue what my weight is but I‚Äö√Ñ√¥m definitely a lot bigger than I was at the worst of my ED, but maybe I‚Äö√Ñ√¥m smaller than I was before it?? I have no clue but I just don‚Äö√Ñ√¥t want to be perceived. I hate that my mom notices the smallest change in anyone‚Äö√Ñ√¥s weight. I‚Äö√Ñ√¥ve told her to stop saying those things because it‚Äö√Ñ√¥s triggering to me and she said ‚Äö√Ñ√∫I‚Äö√Ñ√¥m allowed to just say things sometimes, it doesn‚Äö√Ñ√¥t have to be a big deal‚Äö√Ñ√π. Well to your daughter who has an ED history maybe it is a big deal, ever heard of empathy??!?! My god. How can I deal with such a triggering parent (other than moving out because that‚Äö√Ñ√¥s not an option right now, but trust me I‚Äö√Ñ√¥m working on it)?? She gets defensive and acts like I‚Äö√Ñ√¥m being unreasonable when I want her to respect my boundaries.",mom bad-mouthing about brother's weight,0.4,0.25,0.3076923029585799,0.6,0.3,0.3999999955555556,0.6,0.25,0.3529411723183391,0.6,0.6,0.5999999950000001,0.6,0.3333333333333333,0.4285714239795918,0.4,0.25,0.3076923029585799,0.6,0.3333333333333333,0.4285714239795918,0.6,0.375,0.4615384568047337,0.4,0.2857142857142857,0.3333333284722222,0.2,0.2,0.1999999950000001,0.4,0.125,0.1904761868480726,0.6,0.4285714285714285,0.499999995138889,0.6,0.3,0.3999999955555556,0.6,0.6,0.5999999950000001,0.6,0.375,0.4615384568047337,0.6,0.4285714285714285,0.499999995138889,1,external,1,"['comments about brother gaining weight', 'comments about writer being smaller']","['mom making comments about brother gaining weight', ""mom commenting on writer's weight""]","['mom constantly making comments about brother', 'mom noticing smallest change in anyone‚Äôs weight']",1,mom making comments about weight,mom constantly making comments about her weight and her brother’s weight,mom making weight-related comments about writer and brother,1,"[""mom making comments about brother's weight"", ""mom commenting on writer's weight""]",mom constantly making comments about weight and bodies,"[""mom's comments about brother and own weight""]",1,"['mom commenting on brother', 'mom commenting on writer']","['mom commenting on brother gaining weight', 'mom commenting on writer being smaller than before', 'mom constantly noticing weight changes in people']",['mom commenting about weight and eating habits'],4
