ly35lb,"Hi, I suffer from anorexia nervosa (and other mental health issues) sense I was 14 years old, I won‚Äö√Ñ√¥t say any other details about it so it won‚Äö√Ñ√¥t be triggering.
 
 In a week or two I will go to a retreat (residential) for eating disorder, I am still working on other aspects of my mental health by going to group therapy, for almost two years, and now I am more stable and have enough tools to take the ‚Äö√Ñ√∫next step‚Äö√Ñ√π.
 
 I am scared about trying something new or that I will fail and that it will be a waste of time and money, don‚Äö√Ñ√¥t want to put weight on because even if I‚Äö√Ñ√¥m under weight I still see myself ‚Äö√Ñ√∫heavy‚Äö√Ñ√π and need to count calories to feel less anxious.
 
 
 My ED has taken over 7 years of my life, and this is the worse that I‚Äö√Ñ√¥ve ben, not being able to even go to the beach and wearing long pants even in the middle of summer and I can‚Äö√Ñ√¥t even see or smell food that I feel so nauseous.
 
 All my low self-esteem now comes by my ED, people continue saying how skinny I am or 
 ‚Äö√Ñ√∫oooh do you ever eat because you look like you don‚Äö√Ñ√¥t‚Äö√Ñ√π
 ‚Äö√Ñ√∫Where does your food go when you are eating?I only see bones‚Äö√Ñ√π
 ‚Äö√Ñ√∫You need to eat you look really skinny‚Äö√Ñ√π
 ‚Äö√Ñ√∫You don‚Äö√Ñ√¥t eat I can see it‚Äö√Ñ√π
 ‚Äö√Ñ√∫You look like your ill‚Äö√Ñ√π
 ‚Äö√Ñ√∫Do you have food in your house?‚Äö√Ñ√π
 ‚Äö√Ñ√∫Does your dad neglect you?‚Äö√Ñ√π
 And other things that trigger me so much.
 
 People have ben commenting on about my body sense I remember, every time someone had to find something bad.
 I don‚Äö√Ñ√¥t believe when people say that I‚Äö√Ñ√¥m pretty or beautiful because they are being pity and the only thing that I see is not my body, but something else like I don‚Äö√Ñ√¥t belong in and it‚Äö√Ñ√¥s not mine.
 
 
 It‚Äö√Ñ√¥s taken over so much that I can‚Äö√Ñ√¥t start a job or finish school for how much stressful it is, I am really regretting that I will go in this recovery program.
 It‚Äö√Ñ√¥s taken over my friendships and my old relationships because people cared about me and wanted me to eat but I would just say that I didn‚Äö√Ñ√¥t want to and they would get frustrated.
 It takes over my ‚Äö√Ñ√∫intimate life‚Äö√Ñ√π 
 
 But I don‚Äö√Ñ√¥t want to get better and I think that I will actually dropping out of the retreat after a couple of days.
 
 I don‚Äö√Ñ√¥t feel even validated because my dad doesn‚Äö√Ñ√¥t understand, even if I eat something small he starts saying ‚Äö√Ñ√∫oh. .is that because you suffer from ED?‚Äö√Ñ√π and that makes me want to starve myself because I need to show him and prove what is really going on.
 When I told him about the program he only said ‚Äö√Ñ√∫why all of the sudden you are putting your ED as a priority? i see you eat‚Äö√Ñ√π and that makes me feel like actually I have no problems when it comes to food or I am doing all this for attention and he is making me regret to start the program. 
 My mom and other members of the family think that I‚Äö√Ñ√¥m crazy and just being childish when it comes to food and being picky and then when my therapist told to her what wad going on she didn‚Äö√Ñ√¥t believe her or me, she only said that I was not that skinny and I didn‚Äö√Ñ√¥t need to go see a doctor.
 And then when my mom/dad cook food for me and I don‚Äö√Ñ√¥t eat they always put money in the conversation saying that they payed, I mean it‚Äö√Ñ√¥s true but I told them that I don‚Äö√Ñ√¥t eat a lot of food.
 
 The only thing that keeps me going is the support of my few friends and my GF that say that even if they don‚Äö√Ñ√¥t have an ED like me and don‚Äö√Ñ√¥t understand about the situation 100% are proud of me and want the best and see me happy and succede in a carrier and be here for me when I most needed.
 
 I know that I have to do this for me and nobody else but me, but only thinking about it makes me feel anxious, depressed and so guilty about my life choices or emotions.
 What happens once I recover? Will people recognize how I look because I will be in a normal weight range? Will people criticize me saying how I didn‚Äö√Ñ√¥t need to loose weight?
 There is only one way to find out.",comments by friends and family,0.8,0.1333333333333333,0.228571426122449,0.0,0.0,0.0,0.2,0.1111111111111111,0.1428571382653062,0.4,0.25,0.3076923029585799,,,,0.2,0.0833333333333333,0.1176470546712804,0.8,0.1818181818181818,0.2962962932784637,0.4,0.1052631578947368,0.1666666633680556,0.4,0.08,0.1333333305555556,0.4,0.1111111111111111,0.1739130400756144,0.4,0.1052631578947368,0.1666666633680556,0.2,0.0666666666666666,0.0999999962500001,0.8,0.1333333333333333,0.228571426122449,0.4,0.25,0.3076923029585799,0.8,0.1818181818181818,0.2962962932784637,0.4,0.1111111111111111,0.1739130400756144,1,external,1,"['comments about skinny body and being urged to eat', 'feeling invalidated by own family', 'fear of failure or wasting time and money for treatment', 'fear of gaining weight and losing control', 'not feeling pretty or beautiful']","['people commenting on their body', 'parents not believing their struggle']","['Comments about body from others', 'Feeling like a failure']",1,comments from people about body and eating habits,,"['negative comments about body', 'dad does not believe ED is a problem']",1,"[""people's comments on body and eating habits"", 'invalidation by family', 'fear of gaining weight and food', 'imposter syndrome of not feeling pretty or beautiful']","['negative comments about body', 'dad being unsupportive', 'people not believing ED struggles', 'fear of gaining weight and not recognizing self']","['comments on her body', 'family members not believing her', 'fear of failure during recovery program', 'fear of gaining weight', 'stressful life events', 'need to count calories', 'low self-esteem']",1,"['comments about body', 'family not understanding', 'dad questioning eating', 'fear of weight gain', 'regret about recovery program', 'low self-esteem']","['comments about weight from others', 'putting on weight', 'counting calories', 'fears about appearance post-recovery', 'family not understanding or believing the problem']","['comments about body', 'dad not understanding', 'mom denying the issue', 'people telling her to eat']",4
lo2143,"Today I decided to start take a few steps towards recovery and I ate a spoonful of Peas for the first time. Just plain Peas. I used to stretch every kind of food to Last me longer and adjust them to suit my cravings for so long that I never realized those Peas were actually gone REALLY bad. I have been eating them for the past 2 Or 3 weeks and never realized it was so acidic because I would only Eat 2 Or 3 of them and Mix it with various diabolical food inventions. Moreover, I ate a few bites of a chocolate and tasted NOTHING at first. It literally felt like chewing nothing. It wasn't until a few hours later that I tried them again and actually was able to sense its taste. 
 Today I learned that I forgot the taste of most of the foods. Sorry if this is basic Or very common but I felt pretty surprised at this revelation. Maybe I denied myself enjoying food for so long that I programmed myself into not tasting it? 
 At the same time, I have this nagging thought in my head that I was able to escape from the overly addictive sugar and other harmful ingredients pushed by the huge food companies and now I surrendered to them, and NOT to being a healthy person. Eating for pleasure feels like a conspiracy a lot of the times and this makes me feel defeated. Like, what if the food actually tastes like the way I tasted them today? Like, nothing? This makes me regret my choice to recover.
 Does anyone else have similar thoughts Or feelings?",eating for pleasure,,,,0.6666666666666666,0.0952380952380952,0.1666666644791666,0.0,0.0,0.0,,,,,,,,,,,,,0.3333333333333333,0.0555555555555555,0.0952380927891157,,,,,,,,,,1.0,0.2307692307692307,0.374999996953125,0.6666666666666666,0.0952380952380952,0.1666666644791666,,,,0.3333333333333333,0.0555555555555555,0.0952380927891157,1.0,0.2307692307692307,0.374999996953125,1,internal,1,,"['eating plain peas that turned bad', 'realizing she forgot the taste of most foods', 'feeling like food pleasure is a conspiracy']","['forgot the taste of most foods', 'regretting choice to recover']",0,,,,1,,"['realization that taste has changed due to eating disorder behaviors', 'fear of surrendering to harmful food', 'regretting choice to recover']",,1,,,"['realizing that food has lost its taste', 'feeling defeated about eating for pleasure']",3
ljmpdr,"I found that page out via my recommendation page from yg and reading their posts makes me feel calmer and safe. I indicated to my mom that she should read it some posts too, I think it helps the other person realise how we feel and how they should speak to us. It's really hard for me to explain exactly what is going on through my head especially if the other person has never experienced that. I am still struggling with many things that I m not going to mention because it might be triggering for me and for others. Regardless, although I know what I need to do, I also need someone to push me through when I am stuck with my thoughts. Reading and rereading these posts acts as a reminder and motivates me to keep it up, I think it could help others as well. I am sure there are many similar pages online",,,,,,,,,,,,,,,,,,,,,,,,,,,,,,,,,,,,,,,,,,,,,,,,,,0,,0,,,,0,,,,0,,,,0,,,,0
lfffjn,"Today is 440 days I have been in a fairly consistent, REAL recovery from the last relapse I had. I'm so proud of myself and I'm struggling a lot in the recent months. Over the summer I had a couple minor slips but was able to stay on track pretty well but lately I've been struggling more with ED thoughts. I love to rock climb but have had to stop on multiple occasions in the past few years to work on recovering. I recently started implementing it back into my life and I LOVE it and it brings me a lot of joy but the ED thoughts are stronger now that I'm doing more consistent exercise (past of compulsive exercise). I've had a lot of recent changes in my life and stressors and I'm afraid of relapsing again... even though I kind of want to (Why is it always like this?)",life changes,0.5,0.1428571428571428,0.2222222187654321,1.0,0.3333333333333333,0.4999999962500001,1.0,0.3333333333333333,0.4999999962500001,0.5,0.1666666666666666,0.24999999625,0.5,0.1666666666666666,0.24999999625,0.0,0.0,0.0,1.0,0.2,0.3333333305555556,1.0,0.4,0.5714285673469389,1.0,0.2222222222222222,0.363636360661157,0.5,0.125,0.1999999968,1.0,0.3333333333333333,0.4999999962500001,1.0,0.4,0.5714285673469389,1.0,0.3333333333333333,0.4999999962500001,0.5,0.1666666666666666,0.24999999625,1.0,0.4,0.5714285673469389,1.0,0.4,0.5714285673469389,1,external,1,"['more consistent exercise', 'recent changes and stressors']","['consistent exercise', 'recent changes in life']","['recent changes in my life', 'exercise']",1,implementing rock climbing back into life,implementing rock climbing back into life,recently started exercising consistently with rock climbing,1,"['recent changes in life and stressors', 'implementing rock climbing into life']","['rock climbing', 'stressful life changes']","['reintroducing rock climbing into life', 'recent changes and stressors']",1,"['returning to rock climbing', 'recent changes and stressors']","['exercise', 'recent changes in life', 'stressors']","['recent changes in life', 'exercise']",4
lb8klx,"tl;dr it's a rollercoaster, but I thought if someone could use some insight, I should post maybe?
 
 I started recovery around 6 months ago, but relapsed after 3 weeks, and then came back to it in late October. What made me come back to recovery, was when my best friends sat down with me, and told me they didn't think they could sit down and watch me die anymore, and that it was becoming too much for them. So on the day they told me that, I started actual recovery.
 
 I had extreme hunger for a few weeks, and still sometimes now. I didn't run nor exercise beforehand, and so after a month, my aunt offered me to go to the gym with her. I also started craving a bunch of meats, so I naturally ate a bunch of protein out of nowhere. I started gaining muscle, and I can see I have gained so much muscle back, and yes, I also gained weight along with all this. The weight gain came super fast sometimes, and then would slow down, then go back to fast, then slow down. It's still kind of like that, but now it's up and down, but I honestly don't even weigh myself as often anymore, because it's starting to become irrelevant (VERY SLOWLY). My extreme hunger varies, I still have it on certain days of the week, and certain days it's ALMOST normal, until it hits a certain time sometimes. I will say, to people worried about huge amounts of weight gain very fast, I gained super fast within a week, and I had a massive anxiety attack, almost relapsed. In my experience, that weight isn't real weight, and it's just your body processing it.
 
 Honestly, I have had really tough moments, but I feel so much better and stronger now. I thought going to the gym would make me relapse, or restrict, but I ate even more because I felt more hungry, and I didn't feel bad. I don't feel lightheaded anymore, I can eat out, and I can be happy with my friends again, without feeling like they're worried about me. My advice, is be patient, and don't let yourself scare the living hell out of your recovery. I still have a long way to go, but I thought I would share my experience so far.
 
 &amp;#x200B;
 
 (Edit: I should also say, I haven't done cardio for 4 months, and I FEEL AMAZING)",,,,,,,,,,,,,,,,,,,,,,,,,,,,,,,,,,,,,,,,,,,,,,,,,,0,,0,,,,0,,,,0,,,,0,,,,0
laa6wj,"Tomorrow is my one year since I committed to recovery! I have had some relapses along the way, but I have been steadily in recovery now for about the past 6 months. 
 
 You can see the tattoo in my post history, it‚Äö√Ñ√¥s the most recent post. It says, ‚Äö√Ñ√∫beyond fear lies freedom‚Äö√Ñ√π. 
 
 Getting this tattoo has helped me further commit to recovery. I know now that if relapse again I will feel like a complete fraud with this tattoo on my arm. I know I will inevitably face challenges and likely more disordered eating, but this tattoo reminds me that I never want to get as bad as I did. 
 
 This tattoo isn‚Äö√Ñ√¥t just for my recovery from anorexia but everything that has happened in my life in the past two years. Before I was robbed at gunpoint, thus developing severe PTSD, I was fearless in everything that I did. The robbery completely took that away from me. Then I discovered my boyfriend at the time was a porn addict that was exclusively attracted to underage girls, which made my anorexia so much worse since I always compared myself to underdeveloped 12 year old girls. Our relationship was so toxic and it instilled so much fear in me in so many aspects. 
 
 One year since we broke up and since I decided to commit to recovery, and I can say I actually feel somewhat okay for first time in years now. 
 
 I‚Äö√Ñ√¥ve been through hell and back and I never thought that reaching the place I have in recovery would be possible. But it was, and I am thankful. I am thankful that I let go of him. I am thankful we separated. I am thankful I chose to recover. If I didn‚Äö√Ñ√¥t, I would have been dead by March of last year.
 
 Choosing to start letting go of fear and doing the frightening, but hard work necessary lead me to where I am today. 
 
 Keep on moving forward guys. It‚Äö√Ñ√¥s worth it.",,,,,,,,,,,,,,,,,,,,,,,,,,,,,,,,,,,,,,,,,,,,,,,,,,0,,0,,,,0,,,,0,,,,0,,,,0
l9mxnd,"Ate more than I wanted to
 
 Hi :) 
 So I‚Äö√Ñ√¥m currently attempting recovery from anorexia but I am in a bit of a downer, specifically this past week.
 Today I thought I would try and follow my meal plan to which I did, but in the evening for my evening snack I ate way more than I wanted to. Alongside this, I had a takeaway which was so scary to me yet my mind sort of went F it ?? I don‚Äö√Ñ√¥t know what happened this evening but I let go and it‚Äö√Ñ√¥s scared me and I want to restrict again and not follow my meal plan tomorrow. I don‚Äö√Ñ√¥t know what to do, I hate this cycle of restricting snd then sometimes I eat a lot more than I would like to and then it just goes round and round and round in a perpetual cycle of the same old thing.
 
 Part of me wants to get better but the other part of me doesn‚Äö√Ñ√¥t and wants to lose the weight I‚Äö√Ñ√¥ve put on in recovery plus more . It‚Äö√Ñ√¥s a mindset of two conflicting points and I hate it. Part of me doesn‚Äö√Ñ√¥t want to eat but then the other part of me just wants to eat all these fatty sugary foods (and other stuff too but mostly those types of foods) which I know rationally is because I‚Äö√Ñ√¥ve restricted myself of nutrients so my body is like PlEAsE FEEd M3 which I get but it‚Äö√Ñ√¥s just so hard to allow myself when I feel like I can‚Äö√Ñ√¥t! Plus , I‚Äö√Ñ√¥m still so bloody hungry and I don‚Äö√Ñ√¥t even know how I can be after what I‚Äö√Ñ√¥ve eaten? My stomach is grumbling almost an hour after and another thing is that I can‚Äö√Ñ√¥t stop thinking about food. Is this extreme hunger , idk I‚Äö√Ñ√¥m just ConFuSION and highly frustrated!
 
 Sorry this may not make sense I‚Äö√Ñ√¥m probably rambling a lot I just felt like I needed to get it out there. 
 Regardless I hope that other people are having a good day/night wherever you are because you deserve it and you will beat this, we all will I hope ‚Äö√π¬ß√î‚àè√®",overeating,0.0,0.0,0.0,0.0,0.0,0.0,0.0,0.0,0.0,,,,0.0,0.0,0.0,,,,,,,,,,0.0,0.0,0.0,,,,,,,,,,0.0,0.0,0.0,0.0,0.0,0.0,0.0,0.0,0.0,,,,1,internal,1,"['ate way more than I wanted to', 'had a takeaway']","['ate way more than I wanted to', 'had a takeaway']","['ate way more than I wanted to', 'had a takeaway']",1,,ate more than wanted to and had takeaway,,1,,,"['ate more than wanted to for evening snack', 'had a takeaway', 'conflicting mindset about recovery and wanting to lose weight', 'extreme hunger']",0,,,,3
l7fv7h,"I've been getting better for awhile. For at least a year I've been fine with oil, butter, milk in my coffee, etc. All of a sudden this week I've been freaking out about it. I'm trying to make dinner and somehow I can't stomach using oil to cook my veggies. I'm supposed to make some banana bread and my kill-bill sirens went off when I saw how much butter I have to use. This seriously hasn't been an issue for me for such a long time. I don't know why my brain suddenly broke this week. Could someone please offer me some sciencey reassurance.... why my body won't explode if i use butter for my damn bread.......","oil, butter, milk",0.0,0.0,0.0,0.0,0.0,0.0,0.0,0.0,0.0,0.0,0.0,0.0,0.0,0.0,0.0,0.3333333333333333,0.125,0.1818181778512397,0.0,0.0,0.0,0.3333333333333333,0.125,0.1818181778512397,0.0,0.0,0.0,0.0,0.0,0.0,0.3333333333333333,0.0625,0.1052631552354571,0.0,0.0,0.0,0.0,0.0,0.0,0.3333333333333333,0.125,0.1818181778512397,0.3333333333333333,0.125,0.1818181778512397,0.3333333333333333,0.0625,0.1052631552354571,1,external,1,"['sudden onset of fear of using oil or butter', 'making dinner and using oil to cook veggies', 'making banana bread and using butter']","['using oil to cook vegetables', 'using butter for banana bread']","['using oil to cook veggies', 'using butter for banana bread']",1,unknown,unknown,"sudden resurgence of fear of using oil, butter, milk",1,"['sudden onset of fear of oil and butter', 'use of butter in banana bread']","unexplained sudden intensifying disgust with oil, butter, milk",struggling with using oil and butter again,1,"['sudden onset of anxiety', 'seeing oil and butter while cooking']","['sudden increase in anxiety towards oil, butter, and milk', 'cooking healthier options', 'amount of butter in the recipe']","['using oil to cook veggies', 'using too much butter in banana bread']",4
ktih43,"(TW: rituals, implied sizes and numbers)
 
 My boyfriend (35m) and I (22f) are both actors, and have been cast in a film shooting this March. We are playing Danish Vikings and he has been bulking for the past year to gain muscle for the role. However, the shoot is nearly upon us and he begins his cut in a week. 
 
 One of the rituals I‚Äö√Ñ√¥ve found most difficult to overcome during these early stages of recovery is being able to eat when nobody else is. I have found it makes it immensely easier to eat (and keep it down) when we have meals together. Especially since he is trying to pile in as many calories as possible, I can trick Ana into thinking I‚Äö√Ñ√¥m eating less because it looks small in comparison. 
 
 In a nutshell, I am guilty of constantly comparing my portions and calories to his to ensure that I eat a significantly smaller portion than he does. However, my BMI is less than 16 at the moment and I‚Äö√Ñ√¥m in the middle of a relapse already. I am terrified that when he starts counting calories it will send me over the edge and I won‚Äö√Ñ√¥t be able to recover. 
 
 I am considering inpatient treatment but am deathly afraid of what to expect. Does anybody have any HONEST experience with inpatient treatment? Or living with others who calorie count and not becoming triggered by it?",comparing calorie intake with partner,0.2,0.0384615384615384,0.0645161263267431,0.0,0.0,0.0,0.2,0.1,0.133333328888889,0.0,0.0,0.0,0.0,0.0,0.0,0.0,0.0,0.0,0.0,0.0,0.0,0.6,0.2,0.29999999625,0.4,0.3333333333333333,0.3636363586776859,0.2,0.1428571428571428,0.1666666618055557,0.4,0.2222222222222222,0.285714281122449,0.2,0.1,0.133333328888889,0.2,0.1,0.133333328888889,0.0,0.0,0.0,0.6,0.3333333333333333,0.3636363586776859,0.4,0.2222222222222222,0.285714281122449,1,internal,1,He begins his cut in a week and I am guilty of constantly comparing my portions and calories to his to ensure that I eat a significantly smaller portion than he does.,when her boyfriend starts counting calories for his bulk,"['constantly comparing portions and calories to boyfriend', 'fear of boyfriend counting calories']",1,boyfriend starting to count calories for a film role,boyfriend starting to count calories for film role cut,boyfriend starting to cut and count calories,1,boyfriend starting to count calories,comparison of portion and calorie intake with boyfriend who is bulking for a movie role,comparing portions and calories with boyfriend,1,"['eating alone', 'comparison with boyfriend', 'boyfriend counting calories']","['comparing portions and calories with boyfriend', 'boyfriend starting to count calories']","['eating alone', 'comparing portions and calories to boyfriend', 'boyfriend starting to count calories']",4
